{"canonical_writes":0,"created_utc":"2026-07-28T00:00:00Z","engine_receipt_id":"sha256:5883ff204dc2c5f9a5168106703b5c6da11476e5130907e8efa87de46acf1b73","grants_authority":false,"receipt_id":"sha256:93b57ae61be81e3941e80f1da50cc11b357ef71307e9e13f70af718134eb18bf","resource_usage":{"output_bytes":2048,"rss_bytes":1048576,"wall_seconds":55},"run_request_id":"sha256:1111111111111111111111111111111111111111111111111111111111111111","schema_version":"ScienceLabRunReceipt/v1","terminal_status":"completed","validation_receipt_id":"sha256:8d9ee3dac8c31e2b73477eaee385074aaf8fab780ec8a6b08b1131e59f5c2b89"}
